Erogenous Zone,Best Stimulation Methods,Density and Type of Nerve Endings,Skin Thickness and Sensitivity,Muscle and Tissue Composition,Anatomical Structures,Sensory Pathways,Adaptation Style,Additional Notes
"Clitoris","Gentle to moderate pressure, vibration, rhythmic movements, indirect stimulation through the clitoral hood","Approximately 8,000 nerve endings (primarily Meissner's corpuscles and Pacinian corpuscles), highly sensitive","Very thin skin; high sensitivity due to superficial nerve endings","Erectile tissue similar to penile tissue; engorges with blood during arousal","External glans, clitoral hood, internal crura (legs) extending internally","Large representation in the somatosensory cortex, leading to heightened sensitivity","Can experience sensory overload; variation in stimulation prevents desensitization","Direct stimulation may be too intense for some; indirect or varied pressure often more comfortable"
"G-Spot","Firm pressure, come-hither motion, targeted vibration","Rich in Pacinian corpuscles (deep pressure receptors)","Internal mucosal tissue; sensitivity varies among individuals","Part of the anterior vaginal wall, adjacent to the urethral sponge and Skene's glands","Located about 2–3 inches inside the vagina on the anterior wall","Connected to pelvic nerves; stimulation can lead to intense sensations","Responds well to consistent, firm pressure","Sensitivity can vary widely; some may not find stimulation pleasurable"
"Penis (Glans and Shaft)","Glans: Light touch, licking, gentle sucking, vibration; Shaft: Firmer pressure, stroking","Glans contains about 4,000 nerve endings (Meissner's corpuscles and Pacinian corpuscles); shaft has fewer nerve endings","Glans has thin mucosal skin, highly sensitive; shaft has thicker skin","Erectile tissue (corpora cavernosa and corpus spongiosum) that fills with blood during arousal","Glans (tip), shaft, foreskin (if present)","Innervated by the dorsal nerve of the penis, connecting to the pudendal nerve","May adapt to constant stimuli; varying technique can maintain sensitivity","Sensitivity can be affected by circumcision status"
"Scrotum","Gentle touch, light stroking, warm or cool sensations","Contains Meissner's corpuscles (light touch receptors)","Thin, delicate skin; highly sensitive to temperature and touch","Contains the testes; dartos muscle adjusts scrotal skin tension","External pouch containing testes, epididymis, and vas deferens","Innervated by the genitofemoral nerve and ilioinguinal nerve","Sensitive to changes; gentle, varied stimulation maintains arousal","Care should be taken due to sensitivity; avoid excessive pressure"
"Perineum","Gentle pressure, circular motions, vibration","Rich in nerve endings (Pacinian corpuscles and Ruffini endings)","Moderate skin thickness; sensitive due to underlying nerves","Contains pelvic floor muscles (levator ani, coccygeus)","Area between the genitalia and anus (both in men and women)","Innervated by the pudendal nerve","Responds well to sustained pressure or vibration","Can enhance sensations related to both genital and anal stimulation"
"Anus","Gentle touch, gradual insertion, stretching, vibration (with proper lubrication and relaxation)","High concentration of Meissner's corpuscles, Pacinian corpuscles, and nociceptors","Sensitive mucosal tissue internally; external skin is delicate","Contains internal and external sphincter muscles","Terminal end of the digestive tract; rich vascular supply","Innervated by the inferior rectal nerves (branches of the pudendal nerve)","Requires slow acclimation; sensitivity can increase with relaxation","Proper hygiene, lubrication, and communication are essential for comfort and safety"
"Breasts and Nipples","Light touch, sucking, licking, gentle biting, temperature play (warm or cool sensations)","Rich in Meissner's corpuscles and thermoreceptors","Nipples and areola have thin skin; highly sensitive","Glandular tissue, fat, and connective tissue; smooth muscle fibers in the nipples","Nipple, areola, mammary glands","Innervated by the lateral and medial mammary branches of intercostal nerves","Alternating types of stimulation can maintain sensitivity","Sensitivity can vary with hormonal changes (e.g., menstrual cycle, pregnancy)"
"Neck","Light kissing, gentle stroking, nibbling, soft breathing","High density of Meissner's corpuscles (light touch receptors)","Thin skin, especially on the sides and back of the neck","Underlying muscles (sternocleidomastoid, trapezius)","Proximity to vital structures (carotid arteries); care should be taken","Innervated by the cervical plexus nerves","Responds to light, varied touch; overexposure may reduce sensitivity","Psychological factors (trust, intimacy) enhance sensitivity in this area"
"Ears","Light touch, kissing, nibbling on earlobes, whispering, soft breathing","Rich in Meissner's corpuscles, thermoreceptors, and auditory receptors (for sound stimuli)","Thin skin on earlobes and outer ear","Cartilaginous structure; minimal muscle tissue","Earlobe, helix, auditory canal","Innervated by the great auricular nerve and auriculotemporal nerve","Sensitive to new and varied stimuli; can become desensitized with constant touch","Combination of tactile and auditory stimuli can enhance arousal"
"Lips and Mouth","Kissing, licking, sucking, gentle biting","High concentration of Meissner's corpuscles, thermoreceptors, and taste receptors","Very thin mucosal skin; highly sensitive","Orbicularis oris muscle (controls lip movement); rich blood supply","Lips, tongue, inner cheeks, palate","Innervated by the trigeminal nerve (touch) and facial nerve (taste)","Continuous variation in stimulation maintains sensitivity","Oral stimulation can be both an erogenous activity and a prelude to further intimacy"
"Inner Thighs","Light stroking, kissing, gentle scratching","Moderate density of Meissner's corpuscles","Relatively thin skin; sensitive due to proximity to genitalia","Contains muscles like the adductors; subcutaneous fat","Area between the knee and groin on the inner side of the thigh","Innervated by the obturator nerve and femoral nerve","Responds well to teasing, intermittent touch","Sensitivity can be heightened due to anticipation of genital stimulation"
"Back","Massage with firm pressure, kneading, light scratching","Lower density of superficial nerve endings; deeper Pacinian corpuscles","Thicker skin; less sensitive to light touch","Large muscle groups (e.g., trapezius, latissimus dorsi)","Spine, shoulder blades, lower back","Innervated by the dorsal rami of spinal nerves","Sustained, firm pressure maintains sensation","Massage can promote relaxation and increase overall arousal"
"Buttocks","Firm massage, light slapping (with consent), squeezing","Moderate density of nerve endings; responsive to pressure","Thicker skin with subcutaneous fat; less sensitive to light touch","Gluteal muscles (gluteus maximus, medius, minimus); adipose tissue","Posterior pelvic area","Innervated by the cluneal nerves and branches of the sciatic nerve","Responds to varied pressure; can become desensitized with constant pressure","Psychological factors can enhance sensitivity; associated with feelings of intimacy and vulnerability"
